{
  "title": "RISAT-2BR1",
  "url": "https://www.isro.gov.in/RISAT_2BR1.html",
  "intro": "RISAT-2BR1 Home / Activities / Missions accomplished",
  "features": {
    "Lift-off weight": "628 kg",
    "Altitude": "576 km",
    "Payload": "X-Band Radar",
    "Inclination": "37 deg",
    "Mission Life": "5 years",
    "RISAT": "2BR1 is a radar imaging earth observation satellite. The satellite will provide services in the field of Agriculture, Forestry and Disaster Management. प्रमोचन भार / Launch Mass: 628 Kg प्रमोचक राकेट / Launch Vehicle: PSLV-C48/RISAT-2BR1 उपग्रह का प्रकार / Type of Satellite: Earth Observation निर्माता / Manufacturer: ISRO स्‍वामी / Owner: ISRO अनुप्रयोग / Application: Disaster Management System Earth Observation कक्षा का प्रकार / Orbit Type: LEO (Low Earth Orbit) SALIENT FEATURES OF RISAT-2BR1 Lift-off weight 628 kg Altitude 576 km Payload X-Band Radar Inclination 37 deg Mission Life 5 years More Details PSLV-C48/RISAT-2BR1 Brochure PDF - 4.65 MB Gallery RISAT-2BR1 PSLV-C48 Liftoff and onboard camera view Onboard Camera View of Radial Rib Antenna deployment in RISAT-2BR1"
  },
  "image_urls": [],
  "local_images": [],
  "name": "RISAT-2BR1"
}