{
  "title": "Cartosat-3",
  "url": "https://www.isro.gov.in/Cartosat_3.html",
  "intro": "Cartosat-3 Home / Activities / Missions accomplished",
  "features": {
    "Mean altitude": "509 km",
    "Mean inclination": "97.5°",
    "Overall Mass": "1625 kg",
    "Power Generation": "2000W",
    "Mission Life": "5 years",
    "Cartosat": "3 satellite is a third generation agile advanced satellite having high resolution imaging capability. PSLV-C47 Mission Specifications Mean altitude 509 km Mean inclination 97.5° Overall Mass 1625 kg Power Generation 2000W Mission Life 5 years More Details PSLV-C47 Cartosat-3 Brochure PDF - 5.24 MB Gallery PSLV-C47 Liftoff and onboard camera view VOD of PSLV-C47/Cartosat-3 launch APPLICATIONS Cartosat-3 will address the increased user’s demands for large scale urban planning, rural resource and infrastructure development, coastal land use and land cover etc. प्रमोचन भार / Launch Mass: 1625 kg मिशन कालावधि / Mission Life : 1.2 years शक्ति / Power: 16 Watts प्रमोचक राकेट / Launch Vehicle: PSLV-C47 / Cartosat-3 Mission उपग्रह का प्रकार / Type of Satellite: Experimental निर्माता / Manufacturer: ISRO स्‍वामी / Owner: ISRO More Details PSLV-C47 Cartosat-3 Brochure PDF - 5.24 MB Gallery PSLV-C47 Liftoff and onboard camera view VOD of PSLV-C47/Cartosat-3 launch"
  },
  "image_urls": [
    "https://www.isro.gov.in/media_isro/image/media/Missions/Spacecraft/resized/cartosat3_large.png.webp"
  ],
  "local_images": [
    "images\\Cartosat-3_1.webp"
  ],
  "name": "Cartosat-3"
}