{
  "title": "CARTOSAT – 2A",
  "url": "https://www.isro.gov.in/CARTOSAT_2A.html",
  "intro": "CARTOSAT – 2A Home / Activities / Missions accomplished",
  "features": {
    "Mission": "Remote Sensing",
    "Weight": "690 Kg (Mass at lift off)",
    "Onboard Power": "900 Watts",
    "Stabilization": "3 – axis body stabilised using high torque reaction wheels, magnetic torquers and hydrogen thrusters",
    "Payloads": "Panchromatic Camera",
    "Launch date": "28 April 2008",
    "Launch site": "SHAR Centre Sriharikota India",
    "Launch vehicle": "PSLV- C9",
    "Orbit": "635 km, Polar Sun Synchronous",
    "Inclination": "97.94 deg",
    "Mission life": "5 years",
    "Launch Mass": "690 Kg मिशन कालावधि / Mission Life : 5 years शक्ति / Power: 900 W प्रमोचक राकेट / Launch Vehicle: PSLV-C9 / CARTOSAT – 2A उपग्रह का प्रकार / Type of Satellite: Earth Observation निर्माता / Manufacturer: ISRO स्‍वामी / Owner: ISRO अनुप्रयोग / Application: Earth Observation कक्षा का प्रकार / Orbit Type: SSPO (Sun Synchronous Polar Orbit) More Details PSLV-C9 / CARTOSAT–2A CARTOSAT – 2A IMS-1 Brochure PDF - 1.19 MB Mission Remote Sensing Weight 690 Kg (Mass at lift off) Onboard Power 900 Watts Stabilization 3 – axis body stabilised using high torque reaction wheels, magnetic torquers and hydrogen thrusters Payloads Panchromatic Camera Launch date 28 April 2008 Launch site SHAR Centre Sriharikota India Launch vehicle PSLV- C9 Orbit 635 km, Polar Sun Synchronous Inclination 97.94 deg Mission life 5 years More Details PSLV-C9 / CARTOSAT–2A CARTOSAT – 2A IMS-1 Brochure PDF - 1.19 MB"
  },
  "image_urls": [],
  "local_images": [],
  "name": "CARTOSAT – 2A"
}