{
  "title": "HAMSAT",
  "url": "https://www.isro.gov.in/HAMSAT.html",
  "intro": "HAMSAT Home / Activities / Missions accomplished",
  "features": {
    "Launch date": "May 5, 2005",
    "Launch site": "SHAR Centre, Sriharikota, India",
    "Launch vehicle": "PSLV-C6",
    "Orbit": "Geo-synchronous, 633.355 km (average)",
    "Payloads": "2 Transponders",
    "HAMSAT is a Micro": "satellite for providing satellite based Amateur Radio services to the national as well as the international community of Amateur Radio Operators (HAM). It consists of two transponders-one indigenously developed by Indian Amateurs, with the expertise of ISRO and the experience of HAMSAT-INDIA. The second transponder has been developed by a Dutch Amateur Radio Operator and Graduate Engineering student at Higher Technical Institute, Venlo, The Netherlands. More Details CARTOSAT-1 HAMSAT Cartosat-1 Completes a Decade in orbit (2005 – 2015) Brochure PDF - 1.78 MB प्रमोचक राकेट / Launch Vehicle: PSLV-C6/CARTOSAT-1/HAMSAT उपग्रह का प्रकार / Type of Satellite: Communication निर्माता / Manufacturer: ISRO स्‍वामी / Owner: ISRO अनुप्रयोग / Application: Communication कक्षा का प्रकार / Orbit Type: SSPO (Sun Synchronous Polar Orbit) Launch date May 5, 2005 Launch site SHAR Centre, Sriharikota, India Launch vehicle PSLV-C6 Orbit Geo-synchronous, 633.355 km (average) Payloads 2 Transponders More Details CARTOSAT-1 HAMSAT Cartosat-1 Completes a Decade in orbit (2005 – 2015) Brochure PDF - 1.78 MB"
  },
  "image_urls": [],
  "local_images": [],
  "name": "HAMSAT"
}