{
  "title": "SROSS-2",
  "url": "https://www.isro.gov.in/SROSS_2.html",
  "intro": "SROSS-2 Home / Activities / Missions accomplished",
  "features": {
    "Mission": "Experimental",
    "Weight": "150 kg",
    "Onboard power": "90 Watts",
    "Communication": "S-band and VHF",
    "Stabilization": "Three axis body stabilized (biased momentum) with a Momentum Wheel and Magnetic Torquer",
    "Propulsion system": "Monopropellant (Hydrazine based) Reaction Control System",
    "Payload": "Gamma Ray Burst (GRB) payload and Mono Payload Ocular Electro-Optic Stereo Scanner (MEOSS) built by DLR, Germany",
    "Launch date": "July 13, 1988",
    "Launch site": "SHAR Centre, Sriharikota, India",
    "Launch vehicle": "Augmented Satellite Launch Vehicle (ASLV)",
    "Orbit": "Not realised",
    "Launch Mass": "150 kg शक्ति / Power: 90 W प्रमोचक राकेट / Launch Vehicle: ASLV-D2 ASLV उपग्रह का प्रकार / Type of Satellite: Earth Observation निर्माता / Manufacturer: ISRO स्‍वामी / Owner: ISRO अनुप्रयोग / Application: Earth Observation Experimental More Details ASLV-D2 SROSS-2 Mission Experimental Weight 150 kg Onboard power 90 Watts Communication S-band and VHF Stabilization Three axis body stabilized (biased momentum) with a Momentum Wheel and Magnetic Torquer Propulsion system Monopropellant (Hydrazine based) Reaction Control System Payload Gamma Ray Burst (GRB) payload and Mono Payload Ocular Electro-Optic Stereo Scanner (MEOSS) built by DLR, Germany Launch date July 13, 1988 Launch site SHAR Centre, Sriharikota, India Launch vehicle Augmented Satellite Launch Vehicle (ASLV) Orbit Not realised More Details ASLV-D2 SROSS-2"
  },
  "image_urls": [
    "https://www.isro.gov.in/media_isro/image/media/Missions/Spacecraft/resized/sross-2_large.jpg.webp"
  ],
  "local_images": [
    "images\\SROSS-2_1.webp"
  ],
  "name": "SROSS-2"
}