{
  "title": "GSAT-7",
  "url": "https://www.isro.gov.in/GSAT_7.html",
  "intro": "GSAT-7 Home / Activities / Missions accomplished",
  "features": {
    "Mission": "Communication",
    "Mass At Lift-Off": "2650 kg",
    "Physical Dimensions": "3.1 m X 1.7 m X 2.0 m",
    "Power": "3,000 W (end of life)",
    "Satbilisation": "3-axis stabilized",
    "Launch date": "August 30, 2013",
    "Launch site": "Kourou, French Guiana",
    "Launch vehicle": "Ariane-5 VA-215",
    "Orbit": "74 o E Geo Stationary",
    "Mission life": "> 7 Years",
    "GSAT": "7 is an advanced communication satellite built by ISRO to provide wide range of service spectrum from low bit rate voice to high bit rate data communication. GSAT-7 Communication payload is designed to provide communication capabilities to users over a wide oceanic region including the Indian land-mass. The payload configuration is compatible with I-2.5K bus of ISRO. The GSAT-7 payload design includes Multiband communication. प्रमोचन भार / Launch Mass: 2650 kg आयाम / Dimension: 3.1 m X 1.7 m X 2.0 m मिशन कालावधि / Mission Life : > 7 Years शक्ति / Power: 3,000 W Ariane-5 VA-215 उपग्रह का प्रकार / Type of Satellite: Communication निर्माता / Manufacturer: ISRO स्‍वामी / Owner: ISRO अनुप्रयोग / Application: Communication कक्षा का प्रकार / Orbit Type: GSO (Geosynchronous Orbit) Mission Communication Mass At Lift-Off 2650 kg Physical Dimensions 3.1 m X 1.7 m X 2.0 m Power 3,000 W (end of life) Satbilisation 3-axis stabilized Launch date August 30, 2013 Launch site Kourou, French Guiana Launch vehicle Ariane-5 VA-215 Orbit 74 o E Geo Stationary Mission life > 7 Years"
  },
  "image_urls": [],
  "local_images": [],
  "name": "GSAT-7"
}