{
  "title": "INSAT-3B",
  "url": "https://www.isro.gov.in/INSAT_3B.html",
  "intro": "INSAT-3B Home / Activities / Missions accomplished",
  "features": {
    "Mission": "Very long",
    "Spacecraft Mass": "2,070 (Mass at Lift – off) 970 kg (Dry mass)",
    "Onboard power": "1,712 W",
    "Stabilization": "3 – axis body stabilised biased momentum control system using earth sensors, sun sensors, inertial reference unit, momentum / reaction wheels, magnetic torquers and unified bi-propellant thrusters.",
    "Propulsion": "Liquid Apogee Motor with fuel and oxidizer stored in separate titanium tanks and pressurant in Kevlar wound titanium tank.",
    "Payload": "12 extended C – band Transponders Five Ku band Transponders Mobile Satellite Services (MSS)",
    "Launch date": "22nd March 2000",
    "Launch site": "French Guyana",
    "Launch vehicle": "Ariane -5",
    "Orbit": "Geostationary (83 deg East longitude)",
    "Inclination": "7 deg",
    "Launch Mass": "2,070 Kg मिशन कालावधि / Mission Life : Very long शक्ति / Power: 1,712 W Ariane-5G उपग्रह का प्रकार / Type of Satellite: Communication निर्माता / Manufacturer: ISRO स्‍वामी / Owner: ISRO अनुप्रयोग / Application: Communication कक्षा का प्रकार / Orbit Type: GSO (Geosynchronous Orbit) Mission Communication and Meteorology Spacecraft Mass 2,070 (Mass at Lift – off) 970 kg (Dry mass) Onboard power 1,712 W Stabilization 3 – axis body stabilised biased momentum control system using earth sensors, sun sensors, inertial reference unit, momentum / reaction wheels, magnetic torquers and unified bi-propellant thrusters. Propulsion Liquid Apogee Motor with fuel and oxidizer stored in separate titanium tanks and pressurant in Kevlar wound titanium tank. Payload 12 extended C – band Transponders Five Ku band Transponders Mobile Satellite Services (MSS) Launch date 22nd March 2000 Launch site French Guyana Launch vehicle Ariane -5 Orbit Geostationary (83 deg East longitude) Inclination 7 deg Mission Very long"
  },
  "image_urls": [],
  "local_images": [],
  "name": "INSAT-3B"
}