{
  "title": "IRS-1D",
  "url": "https://www.isro.gov.in/IRS_1D.html",
  "intro": "IRS-1D Home / Activities / Missions accomplished",
  "features": {
    "Mission": "Operational Remote Sensing",
    "Weight": "1250 kg",
    "onboard power": "809 Watts (generated by 9.6 sq.metres Solar Panels)",
    "Communication": "S-band, X-band",
    "Stabilization": "Three axis body stabilized (zero momentum) with 4 Reaction Wheels, Magnetic torquer",
    "RCS": "Monopropellant Hydrazine based with sixteen 1 N thrusters & one 11N thrusters",
    "Payload": "Three solid state Push Broom Cameras: PAN (<6 metre solution )LlSS-3(23.6 metre resolution) and WiFS (189 metre resolution)",
    "Onboard tape recorder": "Storage Capacity : 62 G bits",
    "Launch date": "December 28, 1995",
    "Launch site": "Baikanur Cosmodrome Kazakhstan",
    "Launch vehicle": "Molniya",
    "Orbit": "817 km Polar Sun-synchronous",
    "Inclination": "98.69 o",
    "Repetivity": "24 days",
    "Local time": "10.30 a.m",
    "Mission completed on": "September 21, 2007",
    "More Details PSLV": "C1 / IRS-1D IRS-1D Brochure PDF - 1.06 MB प्रमोचन भार / Launch Mass: 1250kg शक्ति / Power: 809 W प्रमोचक राकेट / Launch Vehicle: PSLV-C1 / IRS-1D उपग्रह का प्रकार / Type of Satellite: Earth Observation निर्माता / Manufacturer: ISRO स्‍वामी / Owner: ISRO अनुप्रयोग / Application: Earth Observation कक्षा का प्रकार / Orbit Type: SSPO (Sun Synchronous Polar Orbit) Mission Operational Remote Sensing Weight 1250 kg onboard power 809 Watts (generated by 9.6 sq.metres Solar Panels) Communication S-band, X-band Stabilization Three axis body stabilized (zero momentum) with 4 Reaction Wheels, Magnetic torquer RCS Monopropellant Hydrazine based with sixteen 1 N thrusters & one 11N thrusters Payload Three solid state Push Broom Cameras: PAN (<6 metre solution )LlSS-3(23.6 metre resolution) and WiFS (189 metre resolution) Onboard tape recorder Storage Capacity : 62 G bits Launch date December 28, 1995 Launch site Baikanur Cosmodrome Kazakhstan Launch vehicle Molniya Orbit 817 km Polar Sun-synchronous Inclination 98.69 o Repetivity 24 days Local time 10.30 a.m Mission completed on September 21, 2007 More Details PSLV-C1 / IRS-1D IRS-1D Brochure PDF - 1.06 MB"
  },
  "image_urls": [],
  "local_images": [],
  "name": "IRS-1D"
}